{
	"$schema": "https://templates.arcane.ofkm.dev/schema.json",
	"name": "My Templates",
	"description": "Docker templates",
	"version": "1.0.0",
	"author": "Me",
	"url": "https://github.com/xaynze1290/compose-repo",
	"templates": [
		{
			"id": "blank-starter",
			"name": "Blank Template",
			"description": "Blank",
			"version": "1.0.0",
			"author": "me",
			"compose_url": "https://raw.githubusercontent.com/yourcompany/docker-templates/main/internal-app/docker-compose.yml",
			"env_url": "https://raw.githubusercontent.com/yourcompany/docker-templates/main/internal-app/.env.example",
			"documentation_url": "https://github.com/yourcompany/docker-templates/tree/main/internal-app",
			"tags": ["starter"],
			"updated_at": "2025-07-01T10:00:00Z"
		}
	]
}
